<?xml version="1.0" encoding="UTF-8"?>
<!--
  Licensed to the Apache Software Foundation (ASF) under one
  or more contributor license agreements.  See the NOTICE file
  distributed with this work for additional information
  regarding copyright ownership.  The ASF licenses this file
  to you under the Apache License, Version 2.0 (the
  "License"); you may not use this file except in compliance
  with the License.  You may obtain a copy of the License at

  http://www.apache.org/licenses/LICENSE-2.0

  Unless required by applicable law or agreed to in writing,
  software distributed under the License is distributed on an
  "AS IS" BASIS, WITHOUT WARRANTIES OR CONDITIONS OF ANY
  KIND, either express or implied.  See the License for the
  specific language governing permissions and limitations
  under the License.
 -->
<Config xsi:noNamespaceSchemaLocation="http:///org.apache.tuscany.das.rdb/config.xsd" xmlns:xsi="http://www.w3.org/2001/XMLSchema-instance">
    
    <ConnectionInfo dataSource="java:comp/env/jdbc/ajaxdastest"/>

    <Command name="AllCompanies" SQL="select * from COMPANY" kind="Select"/>
    
    <Command name="AllCompaniesAndDepartments" SQL="select * from COMPANY left outer join DEPARTMENT on COMPANY.ID = DEPARTMENT.COMPANYID" kind="Select"/>

    <Table tableName="COMPANY">
        <Column columnName="ID" primaryKey="true" generated="true"/>
    </Table>
    
	<Table tableName="DEPARTMENT">
		<Column columnName="ID" primaryKey="true" generated="true"/>
	</Table>
	
	<Table tableName="BOOK">
		<Column columnName="BOOK_ID" primaryKey="true" generated="true"/>
	</Table>
		
	<Relationship name="departments" primaryKeyTable="COMPANY" foreignKeyTable="DEPARTMENT" many="true">
      <KeyPair primaryKeyColumn="ID" foreignKeyColumn="COMPANYID"/>
    </Relationship>
	
	
</Config>
